{
  "specversion": "1.0",
  "id": "11111111-1111-4111-8111-111111111120",
  "type": "profile.tenant-export.ready.v1",
  "source": "excellore/profile",
  "time": "2026-01-01T12:00:00Z",
  "tenantid": "22222222-2222-4222-8222-222222222222",
  "correlationid": "33333333-3333-4333-8333-333333333333",
  "actor": { "sub": "77777777-7777-4777-8777-777777777777", "type": "machine" },
  "data": {
    "tenantId": "22222222-2222-4222-8222-222222222222",
    "exportId": "66666666-6666-4666-8666-666666666666"
  }
}
